,article_id,prod_name,product_type_name,product_group_name,graphical_appearance_name,colour_group_name,garment_group_name,detail_desc,material,seasonality,occasion
699,729318004,Bagira Push Melbourne,Bra,Underwear,Lace,Black,"Under-, Nightwear","Push-up bra in lace and mesh with underwired, moulded, padded cups for a larger bust and fuller cleavage. Narrow, adjustable shoulder straps and a narrow hook-and-eye fastening at the back.",lace,unknown,unknown
700,583989003,Otto sandal SB,Sandals,Shoes,Solid,Dark Green,Shoes,"Imitation leather sandals. Straps with adjustable fasteners and soft, moulded rubber soles.",imitation leather,all year,unknown
701,707769001,DONNER 2-p set,Garment Set,Garment Full body,Front print,White,Jersey Fancy,Set with a long-sleeved bodysuit and pair of trousers in a soft organic cotton blend. Bodysuit with a print motif on the front and press-studs at the crotch. Trousers in velour with an elasticated waist and ribbed hems.,organic cotton blend,all year,casual
702,777640001,Cool Explore hoop pk,Earring,Accessories,Solid,Gold,Accessories,Metal earrings in various sizes and designs. Size from 1.5 cm to approx. 3 cm.,gold,all year,unknown
703,609787016,Aretha tee,Top,Garment Upper body,Embroidery,Black,Jersey Fancy,T-shirt in soft cotton jersey with a motif and beaded appliqués. Ribbing around the neckline.,cotton jersey,all year,casual
704,719629032,BRAD FANCY,Swimwear bottom,Swimwear,All over pattern,Dark Grey,Swimwear,"Swim shorts in woven fabric with an elasticated drawstring waist, side pockets and short legs with slits in the sides. Soft mesh inner shorts.",woven fabric,summer,swimming
705,670949001,W VICTORIA DRESS EQ,Dress,Garment Full body,All over pattern,Dark Blue,Unknown,"V-neck dress in woven fabric with dropped shoulders and short, wide sleeves. Seam at the waist with a tapered bodice, and a rounded hem. Longer at the back. Unlined.",woven fabric,unknown,unknown
706,818621002,Premium JAZZ jogeers NEW,Trousers,Garment Lower body,Melange,Grey,Knitwear,"Joggers in soft, fine-knit cashmere. Regular waist with covered elastication and tapered legs with ribbed hems.",cashmere,fall/winter,casual
707,816824001,TC NEW DECOPATCHES LOVE,Other accessories,Accessories,Embroidery,Dark Pink,Unknown,Iron-on fabric patches to patch and repair garments.,unknown,unknown,unknown
708,549263001,Kanta trouser,Trousers,Garment Lower body,All over pattern,Black,Trousers,Tailored trousers woven in a stretch cotton blend with a concealed zip in the side and fake back pocket. Straight tapered legs with creases and short slits at the hems.,stretch cotton blend,all year,unknown
709,694670005,WAYFARERS,Sunglasses,Accessories,Solid,Black,Shoes,"Sunglasses with plastic frames and UV-protective, tinted lenses.",plastic,all year,unknown
710,880724002,Willow skirt,Skirt,Garment Lower body,All over pattern,Purple,Skirts,"Maxi skirt in an airy, patterned, softly draping weave. High waist with a wide, draped, waistband and smocking and a concealed zip at the back. Satin lining.",unknown,unknown,unknown
711,849267002,Taz leggings,Leggings/Tights,Garment Lower body,Solid,Black,Jersey Fancy,"Leggings in very sturdy jersey with concealed elastication at the waist, sewn-in creases and a concealed zip at the hems.",jersey,all year,casual
712,757006001,SARGASSO HW ANKLE TIGHTS+,Leggings/Tights,Garment Lower body,Placement print,Dark Blue,Jersey Fancy,Ankle-length yoga tights in fast-drying functional fabric. High waist with a wide panel at the top to hold in and shape the waist. Concealed key pocket in the waistband.,functional fabric,unknown,yoga
713,701969002,HAY deal shorts,Shorts,Garment Lower body,All over pattern,Dark Green,Shorts,"Shorts in soft, patterned cotton twill with an elasticated drawstring waist, fake fly and side pockets.",cotton twill,unknown,casual
714,597566001,Matthew ss hood,T-shirt,Garment Upper body,All over pattern,White,Jersey Fancy,"Short-sleeved top in soft, printed jersey with a double-layered hood with a wrapover front.",jersey,all year,casual
715,759637004,Lisbon tencel dress,Dress,Garment Full body,Solid,Light Blue,Dresses Ladies,"Short dress in woven fabric with notch lapels, buttons down the front and a yoke with a pleat at the back. Flap chest pockets, short sleeves with sewn-in turn-ups, and a tie belt at the waist. Unlined.",woven fabric,spring/fall,casual
716,841750001,Catwoman blazer,Blazer,Garment Upper body,Solid,White,Dressed,"Fitted, single-breasted jacket in a soft weave with notch lapels, jetted front pockets, decorative buttons at the cuffs and a single back vent. Lined.",soft weave,all year,professional
717,502621001,Jenny Elastic,Boots,Shoes,Solid,Black,Shoes,Ankle boots with elastic gores in the sides and a loop at the back. Fabric linings and insoles and chunky rubber soles. Heel 8 cm.,unknown,unknown,unknown
718,526302003,Bobby,Sweater,Garment Upper body,Glittering/Metallic,Light Grey,Knitwear,"Wide, long-sleeved jumper in a soft rib knit containing glittery threads with ribbing around the neckline, cuffs and hem.",rib knit with glittery threads,all year,casual or semi-formal
719,917490001,Flirty Hangetta anklet pk,Other accessories,Accessories,Solid,Gold,Accessories,Anklets in different designs of thin metal chain. Adjustable length.,gold,all year,casual or dressy
720,624633001,Messi Scarf,Scarf,Accessories,Check,Off White,Accessories,"Large scarf in a soft, checked weave with fringes on the short sides. Size 65x200 cm.",unknown,unknown,unknown
721,791803001,Justin top,T-shirt,Garment Upper body,All over pattern,Off White,Blouses,Shorter blouse in a patterned linen and cotton weave with a round neckline and low-cut back with a tie detail at the hem. Short puff sleeves with covered elastication. Lined.,linen and cotton weave,unknown,unknown
722,621336002,PE Embla top,Vest top,Garment Upper body,Solid,Light Purple,Unknown,"Loose-fitting top in a lustrous Tencel™ lyocell-blend weave in a V-cut at the top with narrow, adjustable shoulder straps.",Tencel™ lyocell-blend,unknown,unknown
723,788471002,RC dubai medallion shorts,Shorts,Garment Lower body,Solid,Red,Unknown,"Shorts in woven fabric. Relaxed fit with an elasticated drawstring waist, fake fly, side pockets, a welt back pocket, slightly lower crotch and wide legs.",woven fabric,summer,casual
724,838800002,Rita p-cap,Cap/peaked,Accessories,Solid,Light Pink,Accessories,"Cap in an airy cotton weave with a decorative bow on one side, sweatband inside and covered elastication at the back. Lined.",cotton,all year,casual
725,583417002,Muffin LS,Blouse,Garment Upper body,Solid,Light Blue,Jersey Fancy,Draped nursing blouse in patterned satin with a wrapover front with a concealed press-stud and practical inner top for easier nursing access. Long sleeves with buttoned cuffs and an elasticated hem.,satin,unknown,unknown
726,679854011,Maja Cardigan TVP,Cardigan,Garment Upper body,Melange,Light Grey,Knitwear,"Long-sleeved cardigan in a soft, loose knit with no buttons. The polyester content of the cardigan is recycled.",polyester,all year,casual
727,699931001,2PCS LS PJ XMAS DEAL,Pyjama set,Nightwear,Front print,Grey,"Under-, Nightwear","Pyjamas in soft, printed organic cotton jersey. Long-sleeved top with concealed press-studs on one shoulder and ribbed cuffs. Bottoms with an elasticated waist and ribbed hems.",organic cotton jersey,all year,unknown
728,426199010,Ellen Shortie Daisy Low 3p,Underwear bottom,Underwear,Stripe,Dark Grey,"Under-, Nightwear",,unknown,unknown,unknown
729,619918004,Ada ankle sock,Socks,Socks & Tights,All over pattern,Light Pink,"Under-, Nightwear","Thin, patterned socks with a short shaft.",unknown,unknown,unknown
730,739680002,Mia L/S Tee,Top,Garment Upper body,Placement print,Dark Blue,Jersey Fancy,Long-sleeved top in soft cotton jersey with a round neck. Slightly longer at the back.,cotton,all year,casual
731,924650001,Mini-me Cotton Tail,Jacket,Garment Upper body,Solid,Light Beige,Outdoor,"Jacket in soft faux shearling with a stand-up collar, yoke at the back and zip down the front. Dropped shoulders, diagonal jetted chest pockets, discreet pockets in the side seams and a trimmed hem.",faux shearling,fall/winter,casual
732,802598005,PQ VALENTINA JUMPER,Sweater,Garment Upper body,Solid,Light Pink,Knitwear,"Fitted jumper in soft, fine-knit, ribbed cashmere with 3/4-length sleeves and ribbing around the neckline.",cashmere,spring/fall,casual
733,637305005,MILAD fleece jkt,Jacket,Garment Upper body,All over pattern,Light Turquoise,Outdoor,"Jacket in patterned, thermal fleece with a stand-up collar and zip with a chin guard at the front.",thermal fleece,fall/winter,casual
734,890175002,5-P Mia,T-shirt,Garment Upper body,All over pattern,Red,Jersey Fancy,Long-sleeved tops in soft cotton jersey with a round neckline.,cotton,all year,casual
735,549708004,Amanda jumper,Sweater,Garment Upper body,Solid,Light Pink,Jersey Fancy,Jumper in a soft viscose-blend knit with a V-neck and inset lace section at the back. Long sleeves with a wide lace edge at the end.,viscose-blend,fall/winter,casual
736,626263002,GILDA LEGGINGS,Leggings/Tights,Garment Lower body,Solid,Grey,Jersey Fancy,"Treggings in stretch, denim-look jersey with an elasticated waist, fake fly, fake front pockets and real back pockets.",denim-look jersey,all year,casual
737,845967003,DIV Isafie,Cardigan,Garment Upper body,Solid,White,Unknown,"Cardigan in a soft, loose, textured knit with 3/4-length sleeves with sewn-in turn-ups. No buttons.",knit,all year,casual
738,761490001,Nasa Camp Tee,T-shirt,Garment Upper body,Front print,Black,Jersey Fancy,T-shirt in printed cotton jersey.,cotton,all year,casual
739,700861001,Mitchell top,Top,Garment Upper body,Solid,Dark Blue,Jersey Fancy,"Long, pleated top in jersey with a sheen, with long sleeves and overlocked edges at the cuffs and hem.",jersey,all year,casual
740,630675002,6p Claw,Hair clip,Accessories,Solid,Light Beige,Accessories,Hair clips in coloured plastic.,coloured plastic,all year,unknown
741,903824003,Neroli sweater,Sweater,Garment Upper body,Other structure,Red,Knitwear,"Jumper knitted in soft chenille yarn with long puff sleeves and ribbing around the neckline, cuffs and hem.",chenille,fall/winter,casual
742,875915001,Addison top,T-shirt,Garment Upper body,All over pattern,Yellow,Jersey Fancy,"Long-sleeved top in soft, patterned cotton jersey with a frill-trimmed yoke at the front and a small opening and button at the back of the neck.",cotton jersey,spring/fall,casual
743,828863001,Olive dress,Dress,Garment Full body,All over pattern,Light Pink,Jersey Fancy,Dress in textured jersey made from a cotton blend with a round neck and small opening with a button at the back of the neck. Short sleeves with a decorative flounce around the seams. Unlined.,cotton blend,spring/fall,casual
744,789808002,Skylar Chunky Sweater,Sweater,Garment Upper body,Melange,Grey,Knitwear,Short jumper in a soft rib knit with low dropped shoulders and long sleeves.,rib knit,fall/winter,casual
745,818806002,OL Dog quilted coat,Other accessories,Accessories,Solid,Black,Accessories,Quilted jacket for a dog in woven fabric with a collar and opening for a leash at the back of the neck. Opening for the front legs and an adjustable hook and loop tab that fastens at the top. Narrow elastic straps for the back legs that help to keep the jacket in place. Lined.,woven fabric,unknown,unknown
746,852092001,SPEED 2 AVA BLOUSE,Blouse,Garment Upper body,Solid,Black,Blouses,"Blouse in satin with a square neckline, seam under the bust and pleated section at the front. Smocking at the back, and 3/4-length sleeves with elastication at the top and an elasticated seam, smocking and a frill trim at the cuffs. Lined front.",satin,all year,casual
747,769801003,Fralla Top,Vest top,Garment Upper body,Solid,Beige,Blouses,"Short top in an airy weave with narrow, tie-top shoulder straps and a small frill trim a the top.",unknown,unknown,unknown
748,797618001,Pamina WL boot,Boots,Shoes,Solid,Black,Shoes,"Warm-lined boots in imitation suede with imitation leather details, and an ankle-height shaft with lacing at the front. Faux fur linings and insoles and fluted soles. Heel 4.5 cm.",imitation suede,fall/winter,casual
749,894687002,Banksy Sneaker,Sneakers,Shoes,Solid,Light Beige,Shoes,Block-coloured trainers in imitation leather and imitation suede with a lightly padded edge and lacing at the front. Linings in mesh made from recycled polyester. Cotton twill insoles and patterned soles.,imitation leather and imitation suede,all year,casual
750,744126003,WEEKEND SWETTIS,Sweater,Garment Upper body,Front print,White,Jersey Fancy,"Top in soft fabric with long sleeves and ribbing around the neckline, cuffs and hem.",soft fabric,fall/winter,casual
751,744073001,Ariel playsuit,Trousers,Garment Lower body,All over pattern,Black,Trousers,"Playsuit in an airy, patterned viscose weave with a deep V-neck, gently dropped shoulders and long, wide sleeves with elastication and a flounce at the cuffs. Wrapover top, elasticated seam at the waist with ties at the side and a second layer below the waist to form a wrapover peplum with a short flounce at the hem.",viscose,spring/fall,casual or semi-formal
752,803624002,Mondrian Sneaker,Sneakers,Shoes,Solid,Gold,Shoes,"Trainers in imitation leather with lacing at the front and a lightly padded edge and tongue. Mesh linings, fabric insoles and rubber soles.",imitation leather,all year,casual
753,633781013,Boulevard TOP PRODUCT,T-shirt,Garment Upper body,Placement print,Dark Blue,Jersey Fancy,T-shirt in soft viscose jersey with a motif on the front.,viscose,all year,casual
754,743128001,Leaf Flower 1p Tights,Underwear Tights,Socks & Tights,All over pattern,Off White,Socks and Tights,Leaf-patterned tights with an elasticated waist.,unknown,unknown,unknown
755,680626001,Jasper Jaquard Trapper Hat,Hat/beanie,Accessories,Jacquard,Black,Accessories,"Jacquard-knit hat with earflaps, faux fur details, a sewn-in turn-up at the front and ties under the chin. Fleece lining.",jacquard,fall/winter,casual
756,562165001,SB P-CAP CLASSIC,Cap/peaked,Accessories,Stripe,Dark Blue,Accessories,Cap in a cotton weave with an appliqué on the front and an adjustable plastic fastener at the back.,cotton,all year,casual
757,696356003,P-CAP OWN,Cap/peaked,Accessories,Mixed solid/pattern,Dark Blue,Accessories,Cap with a sweatband in a cotton weave and an adjustable plastic fastener at the back.,cotton,all year,casual
758,738099001,Cool Expensive Necklace,Necklace,Accessories,Solid,Gold,Accessories,"Necklaces in metal chains of different designs. Adjustable length 43-51 cm, 50-58 cm and 58-66 cm.",metal,all year,unknown
759,706371005,Jonas skirt,Skirt,Garment Lower body,Solid,Light Pink,Skirts,"Short, bell-shaped skirt in imitation suede with decorative metal details on the front of the waistband, and a concealed zip at the back. Unlined.",imitation suede,unknown,unknown
760,693331001,JAVA trousers,Outdoor trousers,Garment Lower body,Solid,Dark Grey,Unknown,"Outdoor trousers in slightly stretchy fabric with sections in water-repellent functional fabric. Elasticated waist, zip fly and button, side pockets, a zipped leg pocket and a drawstring at the hems. Unlined.",stretchy fabric,all year,outdoor activities
761,683622004,PICKLE jumsuit,Pyjama jumpsuit/playsuit,Nightwear,All over pattern,Other Pink,Jersey Fancy,"Sleeveless playsuit in airy viscose with a print motif at the top and crossover straps at the back. Elasticated seam at the waist, side pockets and short legs.",viscose,unknown,unknown
762,613530001,CE Myrtle dress,Dress,Garment Full body,Metallic,Light Grey,Special Offers,"CONSCIOUS EXCLUSIVE. Calf-length dress in a Tencel™ lyocell and silk weave containing glittery threads. Narrow cut at the top with straight, gentle draping, a high collar, gathers down the front and ties at the neck. Deep V-neck at the back and a seam at the hem with a flared skirt and slit at the front. Slightly longer at the back. Lined bodice.",Tencel™ lyocell and silk,unknown,unknown
763,825550001,RIHANNA DRESS,Dress,Garment Full body,Solid,Black,Jersey Fancy,Calf-length dress in soft cotton jersey with a round neckline and short sleeves. Elasticated seam and a detachable tie belt at the waist and a wrapover skirt. Unlined.,cotton jersey,all year,casual
764,774075004,BROOKE PIQUE SLIM TEE,T-shirt,Garment Upper body,Solid,Light Pink,Jersey Basic,Round-necked T-shirt in soft cotton piqué.,cotton,all year,casual
765,900271001,HM+ Cora LS,Top,Garment Upper body,Solid,Black,Jersey Fancy,Long-sleeved top in soft viscose jersey with a V-neck and a rounded hem.,viscose,all year,unknown
766,752815001,LISA LINEN DRESS,Dress,Garment Full body,Solid,Dark Grey,Jersey Fancy,"Calf-length, sleeveless dress in soft linen jersey with a V-neck front and back and slits in the sides.",linen jersey,all year,unknown
767,664622001,Stef seamless hood,Top,Garment Upper body,Solid,Light Grey,Jersey Fancy,"Running top in fast-drying, breathable functional fabric with jacquard-patterned sections and reflective details. Hood and zip at the top, and long raglan sleeves with thumbholes at the cuffs. Seamless.","fast-drying, breathable functional fabric",unknown,running
768,550818001,BIRCH Relaxed shirt - check,Shirt,Garment Upper body,Check,Light Blue,Shirts,"Straight-cut, checked shirt in an airy cotton-blend weave with wool and viscose. Relaxed fit with a turn-down collar, classic front and gently tapered waist. Yoke with a pleat at the back, and long sleeves with adjustable buttoning at the cuffs.",cotton-blend weave with wool and viscose,all year,casual or office
769,700946007,LEO HOOD 14.99,Hoodie,Garment Upper body,All over pattern,Light Beige,Jersey Fancy,"Cropped top in lightweight, printed sweatshirt fabric. Hood with a wrapover front, low dropped shoulders and long sleeves with ribbed cuffs.",sweatshirt fabric,unknown,casual
770,763665001,Nagini oversized shopper,Bag,Accessories,All over pattern,Black,Accessories,"Large shopper in grained imitation leather with decorative metal details, shoulder straps and a magnetic fastener at the top. Size approx. 14.5x42x60 cm.",imitation leather,unknown,unknown
771,815848001,Kiev,Jacket,Garment Upper body,Solid,Black,Outdoor,"Straight-cut coat in soft, stretch imitation suede with a small stand-up collar, detachable tie belt at the waist and no fasteners. Patch front pockets and raw edges at the cuffs and hem. Unlined.",imitation suede,unknown,unknown
772,557548002,Martha Scarf,Scarf,Accessories,Stripe,Light Beige,Accessories,Scarf in a soft weave with fringes on the short sides. Size 65x195 cm.,soft weave,all year,unknown
773,585251001,BESTIE headband,Hat/beanie,Accessories,Jacquard,Grey,Accessories,Double-layer headband in a soft jacquard knit containing glittery threads.,jacquard knit containing glittery threads,all year,unknown
774,720501001,ES Ellen shorts,Shorts,Garment Lower body,Solid,Greenish Khaki,Trousers,"Shorts in stretch twill with a zip fly and button, front and back pockets and sewn-in turn-ups at the hems.",stretch twill,unknown,casual
775,826498001,Fletcher,Sweater,Garment Upper body,Melange,Grey,Knitwear,"Jumper in a soft, fine knit containing some wool with long puff sleeves and ribbing around the neckline, cuffs and hem. The polyester content of the jumper is recycled.",wool and recycled polyester,fall/winter,casual
776,579010021,SWEATSHIRT AOP/RAGLAN,Sweater,Garment Upper body,Colour blocking,Red,Jersey Basic,"Long-sleeved top in soft organic cotton sweatshirt fabric with a press-stud on one shoulder (no press-stud in sizes 1-4Y). Ribbing around the neckline, cuffs and hem. Soft brushed inside.",organic cotton,fall/winter,casual
777,451380032,Bruce denim,Trousers,Garment Lower body,Denim,Light Blue,Trousers,"5-pocket jeans in washed stretch denim with a regular waist, zip fly and skinny legs.",denim,all year,casual
778,697175001,A-band Signe,Hair/alice band,Accessories,Solid,Dark Blue,Accessories,Fabric-covered plastic Alice band with a bow on top.,fabric-covered plastic,all year,unknown
779,639332003,Disa dress,Dress,Garment Full body,Solid,Dark Turquoise,Unknown,Dress in a silk weave with a concealed zip at the back with a concealed hook-and-eye fastening at the top. Short trumpet sleeves and a tie belt at the waist. Lined.,silk,all year,party
780,384482002,Godfather slim chino,Trousers,Garment Lower body,Solid,Dark Beige,Trousers,"Chinos in washed stretch cotton twill with an extended waistband, concealed hook-and-eye fastener, side pockets, and welt back pockets with a button. Slim fit.",cotton,all year,formal
781,588809006,PELLE fancy polo SB,T-shirt,Garment Upper body,Stripe,Green,Jersey Basic,Polo shirt in organic cotton jersey with a ribbed collar and button placket.,organic cotton jersey,spring/fall,casual
782,542982002,TP KEVIN sweatpants BB,Trousers,Garment Lower body,Melange,Dark Blue,Jersey Basic,"Joggers in lightweight sweatshirt fabric with an elasticated drawstring waist, side pockets and ribbed hems.",sweatshirt fabric,unknown,casual
783,655882001,Ponyta blazer,Blazer,Garment Upper body,All over pattern,Black,Outdoor,Jacket in a patterned crêpe weave with a detachable tie belt at the waist and long sleeves with slits at the cuffs. No fasteners. Unlined.,crêpe weave,all year,unknown
784,741804001,Ophelia Hipster Poppy,Underwear bottom,Underwear,Solid,White,"Under-, Nightwear","Lace hipster briefs with a low waist, lined gusset and cutaway coverage at the back.",lace,unknown,unknown
785,855471001,Reagan SS solid,Shirt,Garment Upper body,Solid,Dark Green,Shirts,"Short-sleeved shirt in a cotton weave with a resort collar, French front and yoke at the back. Open chest pocket and slits in the sides.",cotton,all year,casual
786,651490001,Ronaldo thin hood,Hoodie,Garment Upper body,Front print,Orange,Jersey Fancy,"Long-sleeved top in lightweight sweatshirt fabric with a print motif, jersey-lined hood and ribbing at the cuffs and hem.",sweatshirt fabric,all year,casual
787,747990004,Ava knitted top,Vest top,Garment Upper body,Solid,White,Knitwear,"Jumper in a rib-knit viscose blend with a slight sheen. V-neck, sewn-in wrapover at the front with a large, decorative metal button, and short sleeves.",rib-knit viscose blend with a slight sheen,all year,casual
788,697112001,A-band Jilly,Hair/alice band,Accessories,Solid,Gold,Accessories,Glittery Alice band with a bow on top.,unknown,unknown,unknown
789,859125005,Hercules shirt,Shirt,Garment Upper body,Solid,Beige,Blouses,"Straight-cut shirt in an airy cotton weave with a collar and buttons down the front. Gently dropped shoulders and long sleeves with buttoned cuffs. Double-layered yoke with a seam and pleat at the back, and a rounded hem. Slightly longer at the back.",cotton,all year,casual
790,666044002,Mistletoe highwaist thong,Underwear bottom,Underwear,Glittering/Metallic,Light Pink,"Under-, Nightwear","Briefs in lace and mesh with a high, elasticated waist, lined gusset and string back.",lace and mesh,unknown,unknown
791,630030007,Anna t-shirt,T-shirt,Garment Upper body,Solid,Light Beige,Jersey Fancy,Fitted T-shirt in stretch slub jersey made from Tencel™ lyocell.,Tencel™ lyocell,all year,casual
792,573856023,Snap 5 pocket,Trousers,Garment Lower body,Treatment,Dark Blue,Trousers,"5-pocket ankle-length trousers in washed stretch twill with a washed look, high waist, zip fly and slim legs.",twill,unknown,unknown
793,739669004,IDA Set deal,Garment Set,Garment Full body,Front print,White,Jersey Fancy,Top and leggings with a print motif. Longer top in soft sweatshirt fabric with long sleeves and ribbed cuffs. Leggings in cotton jersey with an elasticated waist.,sweatshirt fabric and cotton jersey,all year,casual
794,704132002,P-CAP 2-PACK BASIC,Cap/peaked,Accessories,Solid,Dark Grey,Accessories,Caps with an adjustable plastic fastener at the back. One cap in cotton jersey and the other in twill made from a cotton and viscose blend.,cotton and viscose blend,all year,casual
795,668012012,KIA tee,T-shirt,Garment Upper body,Solid,Light Yellow,Jersey Basic,"Top in soft organic cotton jersey. Short sleeves with striped, ribbed trims.",organic cotton jersey,all year,casual
796,234421004,Mama 200 den Tights,Underwear Tights,Socks & Tights,Solid,Dark Blue,Socks and Tights,"Matt, opaque tights with extra room for a growing tummy. 200 denier.",unknown,all year,unknown
797,849389004,Jimmy 2P shorts,Shorts,Garment Lower body,All over pattern,Dark Blue,Jersey Fancy,"Shorts in soft, printed cotton jersey with covered elastication and a drawstring at the waist, and side pockets.",cotton jersey,all year,casual
798,650676001,Andre fur slip in,Flat shoe,Shoes,Solid,Black,Shoes,"Faux fur slides with satin linings, faux fur insoles and rubber soles.",faux fur,all year,casual
799,738714005,SIRI hood,Top,Garment Upper body,Melange,Light Turquoise,Unknown,"Sports jacket in fast-drying functional fabric with a small stand-up collar, hood, front pockets and a contrasting colour zip down the front with a chin guard.",fast-drying functional fabric,unknown,unknown
800,864755001,Ilse 2p brazilian,Underwear bottom,Underwear,Solid,Black,"Under-, Nightwear","Brazilian briefs in lace with a regular waist, lined gusset and high cut at the back.",lace,all year,unknown
801,887559001,Katie playful SG,Boots,Shoes,Solid,Grey,Shoes,Boots with warm faux fur linings and insoles and patterned soles.,faux fur,fall/winter,casual
802,498779006,Sheba maxi dress,Dress,Garment Full body,All over pattern,White,Dresses Ladies,"Long, sleeveless dress in a viscose weave with narrow, adjustable shoulder straps, a V-neck with a sewn-in wrapover and a seam at the waist with ties at one side. Unlined.",viscose weave,all year,party
803,698039001,Banjo Bolero,Cardigan,Garment Upper body,Lace,White,Knitwear,Bolero in a soft cotton pointelle knit with a decorative button at the neck and long sleeves.,cotton,spring/fall,casual
