,article_id,prod_name,product_type_name,product_group_name,graphical_appearance_name,colour_group_name,garment_group_name,detail_desc,material,seasonality,occasion
404,871997001,Bootcut HW Nova,Trousers,Garment Lower body,Denim,Dark Blue,Trousers Denim,"5-pocket jeans in washed, stretch denim with a high waist, zip fly and button and legs with wide, flared hems. The cotton content of the jeans is partly recycled.",denim,all year,casual
405,766974003,Pull on denim shorts,Shorts,Garment Lower body,Denim,Grey,Shorts,"Shorts in washed denim with an elasticated drawstring waist, side pockets and back pockets.",denim,all year,casual
406,670954001,W CAROL TOP,Top,Garment Upper body,Solid,Off White,Unknown,"Short, off-the-shoulder blouse in a crinkled viscose weave. Short sleeves with smocked trims and smocking at the top and hem. Unlined.",viscose,summer,casual
407,536720003,Ronald hood,Hoodie,Garment Upper body,Solid,Dark Green,Outdoor,"Padded bomber jacket in woven fabric with a slight sheen and a pile-lined hood with a faux-fur trim. Zip down the front, a zipped sleeve pocket, flap side pockets with a press-stud and an inner pocket. Ribbing at the cuffs and hem. Lined.",woven fabric,fall/winter,casual
408,827680001,Latte LS,Sweater,Garment Upper body,Solid,White,Jersey Fancy,"Short, fitted top in ribbed jersey with a stand-up collar, zip down the front and long sleeves.",ribbed jersey,fall/winter,casual
409,791648001,Apron dress cord,Dress,Garment Full body,Solid,Dark Red,Blouses,"Short dungaree dress in stretch cotton corduroy with a chest pocket, buttons at the sides and adjustable straps with metal fasteners. Unlined.",cotton corduroy,fall/winter,casual
410,561277001,PLUS Support 70 Den 1 p Tights,Underwear Tights,Socks & Tights,Solid,Black,Socks and Tights,"Semi-opaque tights that shape the tummy, thighs and calves while also encouraging blood circulation in the legs. Elasticated waist. 70 denier.",unknown,unknown,unknown
411,506904001,Whisper dress,Dress,Garment Full body,All over pattern,Dark Blue,Jersey Fancy,"Dress in soft, patterned viscose jersey with narrow shoulder straps and a narrow elasticated seam at the waist. Gently bell-shaped skirt with an asymmetric hem.",viscose jersey,all year,unknown
412,605081002,2P SS PJ SOLID,Pyjama jumpsuit/playsuit,Nightwear,All over pattern,Light Pink,"Under-, Nightwear","All-in-one pyjamas in soft organic cotton jersey with press-studs down the front and at the crotch, short sleeves and short legs.",organic cotton jersey,all year,sleepwear
413,726183003,J DUNHAM TOP EQ,Top,Garment Upper body,All over pattern,Light Pink,Unknown,"Straight-cut top in jersey made from a modal and cotton blend with a V-neck and short, frill-trimmed sleeves.",modal and cotton blend,unknown,unknown
414,770816001,Robbie Tee 9.99:-,T-shirt,Garment Upper body,Colour blocking,Black,Jersey Fancy,T-shirt in soft cotton with contrasting colour panels along the shoulders and sleeves.,cotton,all year,casual
415,547482001,Cousin Hood,Hoodie,Garment Upper body,Embroidery,Grey,Jersey Fancy,"Top in sweatshirt fabric with a lined drawstring hood, embroidered motif on the front and kangaroo pocket. Gently dropped shoulders, long sleeves, and ribbing at the cuffs and hem. Soft brushed inside.",sweatshirt fabric,all year,casual
416,553932006,Ritz flip flop OL,Flip flop,Shoes,Stripe,Dark Green,Shoes,Flip-flops with fabric straps and fluted rubber soles.,fabric,summer,casual
417,749665002,&DENIM Embrace denim shorts,Shorts,Garment Lower body,Denim,Black,Trousers Denim,"Short 5-pocket shorts in washed denim with worn details and a smart stretch function so that the shorts embrace the body for a comfortable and flattering fit. High waist, zip fly and skinny legs.",denim,all year,casual
418,740747001,Zeda Leggings,Leggings/Tights,Garment Lower body,All over pattern,Light Beige,Jersey Fancy,"Leggings in soft, patterned cotton jersey with an elasticated waist.",cotton jersey,all year,casual
419,786579001,Charlotte lowback bra,Bra,Underwear,Solid,Black,"Under-, Nightwear","Strapless balconette bra in lace with underwired, padded cups that lift and shape the bust. Silicone trim at the top of the back, additional support at the sides and front, and a hook-and-eye fastening at the back. V-shaped back so that the bra can be worn under low-cut garments.",lace,unknown,unknown
420,719591002,Basic S/J Set,Garment Set,Garment Full body,All over pattern,Light Pink,Jersey Basic,"Two-piece set in soft, organic cotton jersey. Top with lapped shoulders and long sleeves. Trousers with an elasticated, drawstring waist and ribbed hems.",organic cotton jersey,unknown,unknown
421,664679001,Lion trouser,Trousers,Garment Lower body,Stripe,Black,Trousers,"Wide pull-on trousers in stripe-print viscose crêpe with an elasticated waist, pockets in the side seams and straight legs with a seam at the hems.",viscose crêpe,unknown,casual
422,807506001,ELLE strawbag,Bag,Accessories,Embroidery,Light Beige,Accessories,Shopper in braided paper straw containing glittery threads. Embroidered motif on the front and two handles at the top with decorative tassels in neon colours. Contrasting colour lining. Depth 9.5 cm. Height 28 cm. Width 38 cm.,paper straw with glittery threads,summer,casual
423,698882006,Emma Basic Low BG,Sneakers,Shoes,Solid,Black,Shoes,Cotton canvas trainers with lacing at the front and a loop at the back. Canvas linings and insoles and fluted rubber soles.,cotton canvas,all year,casual
424,839891002,LOGG Sydney Linen Dress,Dress,Garment Full body,Solid,Beige,Blouses,"Knee-length shirt dress in a linen and cotton weave with a collar, buttons down the front and a yoke with a pleat at the back. Flap chest pockets, 3/4-length sleeves with buttoned cuffs, a detachable tie belt at the waist, and slits in the sides. Unlined.",linen and cotton,spring/fall,casual
425,817115001,Geneva top,Top,Garment Upper body,Solid,Off White,Jersey Fancy,"Top in jersey with a small, draped stand-up collar and an opening with a button at the back of the neck. Short cap sleeves and a straight hem. Unlined.",jersey,all year,unknown
426,574801003,Ben fleece overall,Outdoor overall,Garment Full body,All over pattern,Green,Outdoor,"All-in-one suit in soft, thermal fleece with an all-over print, stand-up collar, zip down the front and raglan sleeves.",fleece,fall/winter,outdoor
427,834988001,Bag Albin colour block bumbag,Bag,Accessories,Colour blocking,Dark Beige,Accessories,"Small oval waist bag in a sturdy weave with an appliqué on the front, zip at the top and a zipped outer compartment. Adjustable waist belt with a metal fastener. Size approx. 3.5x12x19.5 cm.",sturdy weave,unknown,casual
428,900679001,Paradiset set.,Shorts,Garment Lower body,All over pattern,Dark Blue,Trousers,"Set with a sleeveless top and pair of shorts in an airy, viscose weave. Top with a round neckline, opening with a button at the back of the neck and tie-detail at the front hem. Shorts with wide elastication at the waist and side pockets.",viscose,summer,casual
429,759409001,Blake Chelsea BG,Boots,Shoes,Solid,Black,Shoes,Chelsea boots in imitation leather with elastic gores in the sides and loops at the top. Fleece linings and insoles and chunky soles. Heel approx. 2 cm.,imitation leather,fall/winter,casual
430,701695003,SKI MITTEN LONG.,Gloves,Accessories,All over pattern,Dark Blue,Accessories,"Ski mittens in windproof, water-repellent, functional fabric with folded seams, elastication at the wrists and top and reflective details. Plastic hook-and-eye fastening to keep the gloves together. Thinsulate™ lining. The mittens have a water-repellent coating without fluorocarbons.",functional fabric,fall/winter,skiing
431,772373001,SKINNY CHEAPO HOOK 79,Trousers,Garment Lower body,Denim,Blue,Trousers Denim,"Slim-fit jeans in washed, stretch denim with an adjustable elasticated waist, zip fly and button, front and back pockets, and narrow hems.",denim,all year,casual
432,811907001,Sporty spice top,Bikini top,Swimwear,Other structure,Other Green,Swimwear,"Fully lined bikini top with removable inserts that shape the bust and provide good support. Narrow, adjustable shoulder straps and covered elastication at the hem. No fasteners.",unknown,summer,party
433,871376002,Kanye HW satin Trs,Trousers,Garment Lower body,Solid,Black,Trousers,"Trousers in satin with a high waist that has covered elastication and loops, one with a decorative D-ring. Diagonal side pockets, flap leg pockets with a tab and D-ring and long, tapered legs with covered elastication at the hems.",satin,unknown,casual
434,733454001,Basic Girly Rib Leggings,Leggings/Tights,Garment Lower body,Solid,Light Pink,Jersey Basic,Leggings in ribbed organic cotton jersey with an elasticated waist and overlocked hems.,organic cotton jersey,all year,unknown
435,739590002,Timeles Cheeky Brief,Swimwear bottom,Swimwear,Solid,Black,Swimwear,Fully lined bikini bottoms with a low waist and cutaway coverage at the back.,unknown,summer,beach/swimwear
436,750347001,&DENIM Shaping HW ancle patche,Trousers,Garment Lower body,Denim,Blue,Trousers Denim,"5-pocket, ankle-length jeans in washed denim with technical stretch that holds in and shapes the waist, thighs and bum while keeping the jeans in shape. High waist, zip fly and button and skinny legs.",denim,all year,casual
437,630777017,Rich Tee,T-shirt,Garment Upper body,Embroidery,Black,Jersey Fancy,Straight-style T-shirt in soft cotton jersey with ribbing around the neckline.,cotton,all year,casual
438,866468001,+ Tyra Shape Highwaist,Swimwear bottom,Swimwear,Solid,Dark Blue,Swimwear,"Fully lined bikini bottoms with a sculpting effect on the waist. High, V-shaped waist and medium coverage at the back.",unknown,summer,beach
439,785889001,Beanie Kaj Cable,Beanie,Accessories,Melange,Black,Accessories,Hat in a soft cable knit with a wide ribbed hem.,unknown,unknown,unknown
440,651306001,EVA,Sweater,Garment Upper body,Melange,Light Beige,Knitwear,"Jumper in a soft, textured knit with long sleeves and ribbing around the neckline, cuffs and hem.",knit,fall/winter,casual
441,544918002,Richie Cardigan,Cardigan,Garment Upper body,Solid,Greenish Khaki,Jersey Fancy,"Cardigan in lightweight sweatshirt fabric with a lined hood, draped lapels and detachable tie belt at the waist. Side pockets, roll edges and an asymmetric hem that is longer at the front.",sweatshirt fabric,all year,casual
442,840061002,Menorca linen dress,Dress,Garment Full body,Solid,Light Orange,Dresses Ladies,"Short dress in a soft linen and viscose weave with a collar, V-neck and buttons down the front. Short sleeves and a tapered waist with a detachable tie belt. Unlined.",linen and viscose,spring/fall,casual
443,522678003,Art leather sneaker PQ,Sneakers,Shoes,Solid,White,Shoes,"Trainers with lacing at the front, leather linings and insoles and rubber soles.",leather,all year,casual
444,489217006,Carolina Boot,Boots,Shoes,Solid,Dark Red,Shoes,"Ankle boots in imitation suede with lacing at the front, a loop at the back, pile linings and insoles and chunky rubber soles. Heel 3.5 cm.",imitation suede,all year,casual
445,802490002,The Highline high waist,Swimwear bottom,Swimwear,All over pattern,Dark Grey,Swimwear,"Fully lined, waist-high bikini bottoms with a high cut at the back.",unknown,summer,unknown
446,903090001,Beamer dress,Dress,Garment Full body,Solid,Light Yellow,Blouses,"Fitted, knee-length cold shoulder dress in a Tencel™ lyocell weave with narrow, adjustable shoulder straps that cross at the back. Wide, double-layered flounce with covered elastication at the top that continues over the sleeves. Short, cotton-lined puff sleeves with concealed elastication for added volume. Concealed zip in one side and a slit at the back. Lined at the top.",Tencel™ lyocell,spring/fall,party
447,821771002,Brenda DEAL set,Shorts,Garment Lower body,Front print,Black,Jersey Fancy,"Set with a T-shirt in cotton jersey and pair of shorts in sweatshirt fabric made from a cotton blend. Printed T-shirt with a round neckline and rounded hem. Shorts with elasticated ribbing and a drawstring at the waist, text print and rounded hems.",cotton jersey and sweatshirt fabric made from a cotton blend,unknown,casual
448,876125001,Twist jumpsuit,Jumpsuit/Playsuit,Garment Full body,Solid,Black,Dresses Ladies,"Ankle-length jumpsuit in jersey with a V-neck and twisted detail with a draped effect and cut-out section at the top. Narrow, adjustable shoulder straps, a seam at the waist and wide, straight legs. Unlined.",jersey,all year,casual or dressy
449,518091001,Alva padded 2pk,Bra,Underwear,Melange,Dark Grey,"Under-, Nightwear","Soft nursing bras in organic cotton jersey with lightly padded, opening cups with space for nursing pads. Slightly wider adjustable shoulder straps and a fastening at the back with three pairs of hooks and eyes.",cotton,all year,everyday
450,780719001,Premium Animal softie,Slippers,Shoes,Solid,Beige,Shoes,Suede slippers with embroidery and a print motif on the front and elastication around the top. Pile linings and insoles and soft soles.,suede,all year,casual
451,648935001,Velma maxi dress,Dress,Garment Full body,Solid,Black,Dresses Ladies,"Jersey maxi dress with a low-cut back with crossover straps, short cap sleeves, an elasticated seam at the waist and slits in the sides.",jersey,all year,casual
452,854004003,Siberian jacket,Jacket,Garment Upper body,Solid,Light Beige,Outdoor,"Boxy jacket in wide-wale cotton corduroy with a collar, large buttons at the front, patch pockets with a flap and button and a concealed side pocket at the front. Dropped shoulders and straight sleeves with adjustable tabs and buttons at the cuffs. Unlined.",cotton corduroy,unknown,casual
453,697493002,PE RUTH CASHMERE TOP,Top,Garment Upper body,Solid,Off White,Unknown,"Fitted polo-neck jumper in airy, fine-knit wool containing some cashmere with long sleeves and raw edges at the cuffs and hem.",wool containing cashmere,fall/winter,casual
454,734305002,Hunter SPEED,Trousers,Garment Lower body,Solid,Black,Trousers,"Joggers in cotton twill with a regular, elasticated drawstring waist, fake fly, side pockets, welt back pockets with a button and tapered legs with elasticated hems.",cotton twill,all year,casual
455,499959002,JULEE FUR SCARF,Scarf,Accessories,Solid,Black,Accessories,"Tube scarf in soft faux fur. Width 25 cm, circumference 70 cm.",faux fur,fall/winter,unknown
456,588573003,Aberdeen,Trousers,Garment Lower body,Solid,Greenish Khaki,Trousers,"Pull-on trousers in cotton twill with an elasticated drawstring waist, side pockets and one back pocket. Tapered legs with decorative seams at the knees and ribbed hems.",cotton,all year,casual
457,708394002,MARY LS,Top,Garment Upper body,Solid,Light Pink,Jersey Fancy,"Fitted, off-the-shoulder top in soft jersey made from a viscose blend with a V-neck front and back and long sleeves.",viscose blend,all year,unknown
458,790288001,Cozy tutu dress,Dress,Garment Full body,Placement print,Dark Pink,Jersey Fancy,"Dress in soft sweatshirt fabric with a press-stud on one shoulder, long raglan sleeves and a lined, glittery tulle skirt.",sweatshirt fabric,unknown,unknown
459,564485008,Alison,Cardigan,Garment Upper body,Solid,Dark Red,Knitwear,"Cardigan in a soft knit with a shawl collar, dropped shoulders and no buttons.",knit,fall/winter,casual
460,737777001,Gainsbourg Coat,Coat,Garment Upper body,Check,Light Beige,Outdoor,"Knee-length, straight-cut coat in woven fabric with notch lapels, concealed press-studs down the front and welt front pockets. Unlined.",woven fabric,spring/fall,casual
461,841668002,Flirty Louise necklace,Necklace,Accessories,Solid,Gold,Accessories,Short thin metal chain necklace with round pendants in hammered metal. Adjustable length 41-48 cm.,metal,all year,casual
462,402065038,OSCAR l/s tee SB,T-shirt,Garment Upper body,Stripe,Dark Blue,Jersey Basic,Long-sleeved top in organic cotton jersey with a ribbed neckline and a chest pocket.,organic cotton jersey,unknown,unknown
463,831714001,Jessie PU Shorts,Shorts,Garment Lower body,Treatment,Black,Shorts,"High-waisted shorts in imitation leather with pleats at the top and wide belt loops at the waist. Zip fly with a concealed hook-and-eye fastener, side pockets, a fake back pocket and sewn-in turn-ups at the hems. Soft, lightly brushed inside..",imitation leather,unknown,unknown
464,453745011,ASHTON,Dress,Garment Full body,All over pattern,Dark Blue,Jersey Basic,"Dress in soft jersey made from a cotton blend with long sleeves, a seam at the waist and flared skirt.",cotton blend,all year,unknown
465,598806001,Dixie tee,T-shirt,Garment Upper body,Stripe,White,Jersey Fancy,Short top in soft cotton jersey with short sleeves. Contrasting colour trims around the neckline and sleeves.,cotton,all year,casual
466,549148010,Csp lavender,Top,Garment Upper body,Application/3D,Grey,Jersey Fancy,T-shirt in soft jersey with embroidered appliqués.,jersey,all year,unknown
467,857661001,Kendrick sleevles hood,Top,Garment Upper body,Solid,Black,Outdoor,"Sleeveless hoodie in fast-drying functional fabric with a mesh-lined, drawstring hood and yoke at the back. Small print motif on the front, a kangaroo pocket and short slits in the sides.",functional fabric,all year,casual
468,811600001,Hallie Lace Dress,Dress,Garment Full body,Lace,Light Blue,Dresses Ladies,"Short dress in lace with a small, pompom trimmed stand-up collar, an opening with a button at the back of the neck and long trumpet sleeves. Seam at the waist with a lace trim, a concealed zip in one side, and raw, scalloped edges at the cuffs and hem. Partly lined in jersey.",lace,all year,party
469,579695001,Swift jumper,Sweater,Garment Upper body,Solid,Dark Red,Jersey Fancy,"Jumper in a soft, fine knit with a deep V-neck at the back and ties at the back of the neck. Long sleeves with lace-trimmed asymmetric cuffs, slits in the sides and a lace trim at the hem.",knit,fall/winter,casual
470,627267002,Corina fancy poncho,Other accessories,Accessories,Solid,Light Orange,Swimwear,"Open poncho in an airy viscose weave with inset lace embroidery, a drawstring at the waist and slits in the sides.",viscose,spring/fall,casual
471,694344003,Jackie brazillian,Underwear bottom,Underwear,Solid,Light Orange,"Under-, Nightwear","Shaping Brazilian briefs in microfibre and lace with a high waist, lined gusset and half-string back. The briefs have a light shaping effect on the tummy and hips.",microfibre and lace,all year,everyday
472,688966001,Two Sherling Jacket,Jacket,Garment Upper body,Solid,Black,Unknown,"Straight-cut jacket in soft imitation leather with a faux fur-lined collar, zip down the front and welt front pockets. Faux fur lining.",imitation leather,all year,unknown
473,607252001,Bubble,Sweater,Garment Upper body,Melange,Grey,Knitwear,"Wide-fitting jumper in a chunky-knit wool blend containing some alpaca wool. Low dropped shoulders, long, wide puff sleeves, and ribbing around the neckline, cuffs and hem.",wool blend containing alpaca wool,fall/winter,casual
474,873003001,HM+ Virgil linen shirt.,Shirt,Garment Upper body,Solid,White,Blouses,"Shirt in an airy linen weave with a turn-down collar, buttons down the front and a yoke with a pleat at the back. Long sleeves with buttoned cuffs, and a gently rounded hem.",linen,spring/fall,casual
475,867357001,Stunning dress,Dress,Garment Full body,Solid,Black,Jersey Fancy,"Calf-length dress in jersey crêpe with a square neckline and long puff sleeves. Gathers at one side to create a draped effect, and a wrapover skirt with a slit at the front. Lined front.",jersey crêpe,unknown,unknown
476,738044001,Japan top,Sweater,Garment Upper body,Solid,Dark Yellow,Knitwear,"Long-sleeved top in a soft rib knit containing some wool with a V-neck, wrapover front and knitted tie belt at the waist. The polyester content of the top is recycled.",wool,fall/winter,casual
477,793185002,Petra 2p bandana,Hair/alice band,Accessories,All over pattern,Dark Blue,Accessories,Scarves in patterned satin that can also be tied as a hairband. Size 30x80 cm.,satin,all year,casual
478,803597001,ED Spirit,Sweater,Garment Upper body,Solid,White,Knitwear,"Off-the-shoulder jumper in a soft, fluffy knit with a wide foldover top edge, long raglan sleeves and ribbing at the cuffs and hem.",knit,fall/winter,casual
479,759951002,Enzo bikini top,Bikini top,Swimwear,Solid,Red,Jersey Fancy,Bandeau bikini top in smocked fabric with ties at the back of the neck and no fasteners.,smocked fabric,summer,beach/pool
480,898598007,Kibble shorts .,Shorts,Garment Lower body,All over pattern,Black,Jersey Fancy,"Shorts in soft cotton jersey with elastication and a decorative bow at the waist, and front pockets.",cotton jersey,unknown,casual
481,897912002,Snape 2PCS set,Garment Set,Garment Full body,Placement print,Black,Jersey Fancy,Set with a long-sleeved top and pair of trousers in soft cotton jersey. Top with a press-stud on one shoulder (except in sizes 1½-4Y) and ribbing around the neckline. Trousers with covered elastication at the waist.,cotton jersey,all year,unknown
482,602716001,PEACH,Blouse,Garment Upper body,Stripe,Light Blue,Blouses,Off-the-shoulder blouse in an airy cotton weave with elastication and a wide flounce at the top.,cotton,spring/fall,casual
483,405310005,Ciara sunglasses,Sunglasses,Accessories,Solid,Black,Accessories,"Sunglasses with plastic and metal frames and tinted, UV-protective lenses.",plastic and metal,all year,unknown
484,550888009,Chris Cargo (1) (1),Trousers,Garment Lower body,Solid,Dark Blue,Trousers,"Stretch cotton twill cargo joggers in a relaxed fit with a zip fly and button and slightly lower crotch. Side pockets, back pockets and leg pockets with a flap and press-stud, and tapered legs with elasticated hems.",stretch cotton twill,all year,casual
485,772193001,Class Pelle hoop pk,Earring,Accessories,Solid,Gold,Accessories,Metal hoop earrings in various designs. Diameter from 1.5 cm to 2 cm.,metal,all year,unknown
486,734287002,Fusili,Blouse,Garment Upper body,Solid,White,Blouses,"Sleeveless blouse in a viscose crêpe weave with a V-neck, covered buttons down the front and a yoke with decorative gathers at the shoulders and back. Rounded hem, longer at the back.",viscose,all year,casual
487,796599001,PARTY Pearl dress,Dress,Garment Full body,Sequin,Light Beige,Dresses Ladies,"Short, fitted dress in mesh with sequined embroidery on the front. Deep V-neck with decorative lacing at the top, an opening at the back with a hook-and-eye fastening at the back of the neck, and a concealed zip at the back. Long sleeves with sequined embroidery at the cuffs. Partly lined.",mesh,unknown,party
488,816657001,Tom tom skirt,Skirt,Garment Lower body,Solid,White,Trousers,"Calf-length skirt woven in a soft modal blend with a high drawstring waist, an adjustable tab with press-studs at the sides and large patch front pockets with a decorative flap. Zip fly and press-studs, and a high slit front and back. Lined.",modal blend,unknown,unknown
489,720752003,Nina saddle bag,Bag,Accessories,Other pattern,Beige,Accessories,"Saddle bag in snakeskin-patterned imitation leather with a handle and detachable, adjustable shoulder strap with carabiner hooks. Flap with a metal fastener, and one inner compartment. Unlined. Size 10x21x25 cm.",imitation leather,all year,unknown
490,650790002,S.U Nanna Cardigan(1),Cardigan,Garment Upper body,Solid,Dark Blue,Special Offers,"Cardigan in soft, fine-knit cotton with long sleeves, buttons down the front and short slits in the sides. Ribbing around the neckline, cuffs and hem.",cotton,all year,casual
491,521302006,Make the boys wink,Sweater,Garment Upper body,Melange,Green,Knitwear,"Wide jumper in a soft rib knit containing some wool with low dropped shoulders, long sleeves and ribbing around the neckline, cuffs and hem.",wool,fall/winter,casual
492,883002002,STAR v-neck merino,Sweater,Garment Upper body,Melange,Dark Blue,Knitwear,"Classic V-neck jumper in fine-knit merino wool with long sleeves and ribbing around the neckline, cuffs and hem.",merino wool,fall/winter,casual
493,776724003,D2 PE KHARMA SATIN,Shirt,Garment Upper body,Solid,Dark Pink,Unknown,"Blouse in softly draping silk with a high collar and concealed zip at the back. Long sleeves with a high slit and covered buttons at the cuffs, and a straight-cut hem.",silk,unknown,unknown
494,664715002,Cable tights,Underwear Tights,Socks & Tights,Solid,Light Pink,Socks and Tights,"Tights in a soft, cable-knit cotton blend with an elasticated waist.",cotton blend,unknown,unknown
495,747432006,BETH PRICE SWETTIS,Sweater,Garment Upper body,Front print,Yellow,Jersey Fancy,"Top in soft sweatshirt fabric with a print motif, dropped shoulders, long sleeves and ribbing around the neckline, cuffs and hem. Soft brushed inside.",sweatshirt fabric,all year,casual
496,779249001,Basic rib shorts,Shorts,Garment Lower body,Solid,Light Pink,Jersey Basic,"Shorts in soft, ribbed organic cotton jersey with an elasticated waist and overlocked hems.",cotton,all year,casual
497,653221002,Amadore tee,T-shirt,Garment Upper body,Solid,Yellow,Unknown,Round-necked T-shirt in cotton jersey with a decorative seam at the top.,cotton,all year,casual
498,595311002,Kiwi top SW BIG,Bikini top,Swimwear,Solid,White,Swimwear,Fully lined bikini top with removable inserts and a concealed plastic ring at the front. Narrow adjustable shoulder straps and a metal fastening at the back.,unknown,summer,beach
499,892850001,Malva dress,Dress,Garment Full body,Solid,Dark Red,Dresses Ladies,"Sleeveless, knee-length dress in woven fabric with a collar and a V-neck opening with a concealed button at the front. Seam at the waist and a belt with metal D-rings. Unlined.",woven fabric,unknown,unknown
500,375585001,Sigge shorts,Trousers,Garment Lower body,Melange,Grey,Jersey Basic,"Shorts in sweatshirt fabric with an elasticated drawstring waist, side pockets, one back pocket and raw-edge hems.",sweatshirt fabric,all year,casual
